{
  "name": "usb-c-power-input",
  "description": "USB Type-C 16-pin USB 2.0 power input sink block with 5.1k CC1/CC2 pull-down resistors and VBUS bulk capacitor.",
  "parts": [
    {
      "ref": "J1",
      "libId": "Connector:USB_C_Receptacle_USB2.0_16P",
      "value": "USB_C_Receptacle_USB2.0_16P",
      "footprint": "Connector_USB:USB_C_Receptacle_GCT_USB4085",
      "group": "Power Input"
    },
    {
      "ref": "R1",
      "libId": "Device:R",
      "value": "5.1k",
      "footprint": "Resistor_SMD:R_0603_1608Metric",
      "group": "Power Input"
    },
    {
      "ref": "R2",
      "libId": "Device:R",
      "value": "5.1k",
      "footprint": "Resistor_SMD:R_0603_1608Metric",
      "group": "Power Input"
    },
    {
      "ref": "C1",
      "libId": "Device:C",
      "value": "10u",
      "footprint": "Capacitor_SMD:C_0805_2012Metric",
      "group": "Power Input"
    }
  ],
  "nets": [
    {
      "name": "VBUS",
      "pins": [
        "J1.A4",
        "J1.B4",
        "C1.1"
      ],
      "kind": "power"
    },
    {
      "name": "CC1",
      "pins": [
        "J1.A5",
        "R1.1"
      ],
      "kind": "signal"
    },
    {
      "name": "CC2",
      "pins": [
        "J1.B5",
        "R2.1"
      ],
      "kind": "signal"
    },
    {
      "name": "GND",
      "pins": [
        "J1.A1",
        "J1.B1",
        "J1.SH",
        "R1.2",
        "R2.2",
        "C1.2"
      ],
      "kind": "ground"
    }
  ]
}
